<?xml version="1.0" encoding="UTF-8"?>
<list
    xmlns:xsi='http://www.w3.org/2001/XMLSchema-instance'
    xsi:noNamespaceSchemaLocation='catalog.xsd'>
    <item>
        <id>1</id>
        <title>Наименование 1</title>
        <price>1</price>
        <item>
            <id>2</id>
            <title>Наименование 2</title>
            <price>2</price>
        </item>
        <item>
            <id>3</id>
            <title>Наименование 3</title>
            <price>3</price>
        </item>
    </item>
    <item>
        <id>4</id>
        <title>Наименование 4</title>
        <price>4</price>
    </item>
    <item>
        <id>5</id>
        <title>Наименование 5</title>
        <price>5</price>
    </item>
</list>
